{
  "$schema": "https://json-schema.org/draft/2020-12/schema",
  "title": "Codex plugin adapter",
  "type": "object",
  "required": [
    "name",
    "version",
    "description",
    "author",
    "skills",
    "interface"
  ],
  "properties": {
    "name": {
      "type": "string",
      "pattern": "^[a-z0-9]+(?:-[a-z0-9]+)*$"
    },
    "version": {
      "type": "string",
      "pattern": "^(0|[1-9][0-9]*)\\.(0|[1-9][0-9]*)\\.(0|[1-9][0-9]*)(?:-(?:0|[1-9][0-9]*|[0-9]*[A-Za-z-][0-9A-Za-z-]*)(?:\\.(?:0|[1-9][0-9]*|[0-9]*[A-Za-z-][0-9A-Za-z-]*))*)?(?:\\+[0-9A-Za-z-]+(?:\\.[0-9A-Za-z-]+)*)?$"
    },
    "description": {
      "type": "string",
      "minLength": 1
    },
    "author": {
      "type": "object",
      "required": ["name"],
      "properties": {
        "name": {
          "type": "string",
          "minLength": 1
        },
        "email": {
          "type": "string",
          "minLength": 1
        },
        "url": {
          "type": "string",
          "pattern": "^https://"
        }
      },
      "additionalProperties": false
    },
    "skills": {
      "type": "string",
      "pattern": "^\\./"
    },
    "mcpServers": {
      "type": "string",
      "pattern": "^\\./"
    },
    "interface": {
      "type": "object",
      "required": [
        "displayName",
        "shortDescription",
        "longDescription",
        "developerName",
        "category",
        "capabilities",
        "defaultPrompt"
      ],
      "properties": {
        "displayName": {
          "type": "string",
          "minLength": 1
        },
        "shortDescription": {
          "type": "string",
          "minLength": 1
        },
        "longDescription": {
          "type": "string",
          "minLength": 1
        },
        "developerName": {
          "type": "string",
          "minLength": 1
        },
        "category": {
          "type": "string",
          "minLength": 1
        },
        "capabilities": {
          "type": "array",
          "items": {
            "type": "string",
            "minLength": 1
          }
        },
        "defaultPrompt": {
          "type": "string",
          "minLength": 1
        },
        "websiteURL": {
          "type": "string",
          "pattern": "^https://"
        },
        "privacyPolicyURL": {
          "type": "string",
          "pattern": "^https://"
        },
        "termsOfServiceURL": {
          "type": "string",
          "pattern": "^https://"
        },
        "brandColor": {
          "type": "string",
          "pattern": "^#[0-9A-Fa-f]{6}$"
        },
        "composerIcon": {
          "type": "string",
          "pattern": "^\\./"
        },
        "logo": {
          "type": "string",
          "pattern": "^\\./"
        },
        "logoDark": {
          "type": "string",
          "pattern": "^\\./"
        },
        "screenshots": {
          "type": "array",
          "items": {
            "type": "string",
            "pattern": "^\\./"
          }
        }
      },
      "additionalProperties": false
    }
  },
  "additionalProperties": false
}
