{
  "name": "governance",
  "version": "1.0.0",
  "description": "Tools for creating and managing Claude Code configuration files",
  "author": {
    "name": "Alvis"
  },
  "skills": "./skills/",
  "interface": {
    "displayName": "Governance",
    "shortDescription": "Agent, skill, workflow, and standards governance.",
    "longDescription": "Create, update, review, and validate reusable agent configuration, skills, workflows, and technical standards.",
    "developerName": "Alvis",
    "category": "meta",
    "capabilities": ["Skills", "Hooks"],
    "defaultPrompt": "Help me update an agent workflow or standard."
  }
}
