{
  "name": "client",
  "version": "1.0.0",
  "description": "Client-facing screen design and UX documentation with Notion integration",
  "author": {
    "name": "Alvis"
  },
  "skills": "./skills/",
  "interface": {
    "displayName": "Client",
    "shortDescription": "Client-facing screen design and UX documentation.",
    "longDescription": "Create and maintain client-facing screen designs and UX documentation with Notion integration.",
    "developerName": "Alvis",
    "category": "frontend",
    "capabilities": ["Skills", "Hooks"],
    "defaultPrompt": "Help me design or update a client-facing screen."
  }
}
