{
  "name": "essential",
  "version": "1.0.0",
  "description": "Documentation creation, code design, product strategy, and Notion integration for knowledge management",
  "author": {
    "name": "Alvis"
  },
  "skills": "./skills/",
  "interface": {
    "displayName": "Essential",
    "shortDescription": "Project orchestration, documentation, and knowledge workflows.",
    "longDescription": "Coordinate project delivery, documentation, product strategy, handoffs, and specialist agent installation.",
    "developerName": "Alvis",
    "category": "productivity",
    "capabilities": ["Skills", "Hooks"],
    "defaultPrompt": "Help me coordinate this project."
  }
}
