{
  "name": "react",
  "version": "1.0.0",
  "description": "React component development with UI implementation, design systems, Next.js expertise, and fullstack capabilities",
  "author": {
    "name": "Alvis"
  },
  "skills": "./skills/",
  "interface": {
    "displayName": "React",
    "shortDescription": "React, Next.js, and design-system development.",
    "longDescription": "Build and review React components, Next.js applications, design systems, and full-stack user interfaces.",
    "developerName": "Alvis",
    "category": "frontend",
    "capabilities": ["Skills", "Hooks"],
    "defaultPrompt": "Help me build or review this React feature."
  }
}
