{
  "name": "backend",
  "version": "1.0.0",
  "description": "Domain-specific service and data orchestrator lifecycle management for Theriety",
  "author": {
    "name": "Alvis"
  },
  "skills": "./skills/",
  "interface": {
    "displayName": "Backend",
    "shortDescription": "Service and data orchestrator lifecycle management.",
    "longDescription": "Build and audit backend services, operations, schemas, and data orchestrators.",
    "developerName": "Alvis",
    "category": "development",
    "capabilities": ["Skills", "Hooks"],
    "defaultPrompt": "Help me build or audit a backend service."
  }
}
